{
  "source_chunk_id": "doc_005_chunk_0026",
  "coverage_summary": {
    "source_items_detected": 2,
    "source_items_extracted": 2,
    "source_items_skipped": 0,
    "coverage_notes": "Все извлеченные пункты имеют точные цитаты; заголовки и неразобранные табличные блоки вынесены в skipped_source_items."
  },
  "skipped_source_items": [],
  "statements": [
    {
      "statement_id": "doc_005_chunk_0026_stmt_001",
      "statement": "Отчет по монтажу фиксирует: Установлена Бесперебойная система контроль 5/400.",
      "statement_type": "reporting_requirement",
      "roles": [
        "hq_engineer",
        "installer",
        "manager"
      ],
      "topic": "reporting",
      "source_document_id": "doc_005",
      "source_file": "Отчет по монтажу р1.docx",
      "source_chunk_id": "doc_005_chunk_0026",
      "section_path": [
        "Шаблон отчета по монтажу:",
        "Пример: Установлена Бесперебойная система контроль 5/400",
        "1. Установлена Бесперебойная система контроль 5/400."
      ],
      "source_quote": "Установлена Бесперебойная система контроль 5/400.",
      "source_quote_is_exact": true,
      "related_image_ids": [],
      "visual_review_required": false,
      "risk_level": "important",
      "confidence": "high",
      "review_status": "extracted",
      "scope": "Шаблон отчета по монтажу:",
      "condition": "",
      "action": "",
      "object": "",
      "normalized_terms": [],
      "extraction_notes": "Generated in batch 002 v3 with heading/table quality controls."
    },
    {
      "statement_id": "doc_005_chunk_0026_stmt_002",
      "statement": "Отчет по монтажу фиксирует: Установлен стабилизатор Штиль IS7000, защитные панели на стеллаж(с левой стороны с пенофолом),GSM розетка, байпас для генератора в щит клиента, розетка для подключения холодильника.",
      "statement_type": "reporting_requirement",
      "roles": [
        "hq_engineer",
        "installer",
        "manager"
      ],
      "topic": "reporting",
      "source_document_id": "doc_005",
      "source_file": "Отчет по монтажу р1.docx",
      "source_chunk_id": "doc_005_chunk_0026",
      "section_path": [
        "Шаблон отчета по монтажу:",
        "Пример: Установлена Бесперебойная система контроль 5/400",
        "1. Установлена Бесперебойная система контроль 5/400."
      ],
      "source_quote": "Установлен стабилизатор Штиль IS7000, защитные панели на стеллаж(с левой стороны с пенофолом),GSM розетка, байпас для генератора в щит клиента, розетка для подключения холодильника.",
      "source_quote_is_exact": true,
      "related_image_ids": [],
      "visual_review_required": false,
      "risk_level": "safety_critical",
      "confidence": "high",
      "review_status": "review_required",
      "scope": "Шаблон отчета по монтажу:",
      "condition": "",
      "action": "",
      "object": "",
      "normalized_terms": [],
      "extraction_notes": "Generated in batch 002 v3 with heading/table quality controls."
    }
  ]
}
