{
  "source_chunk_id": "doc_007_chunk_0004",
  "coverage_summary": {
    "source_items_detected": 1,
    "source_items_extracted": 1,
    "source_items_skipped": 0,
    "coverage_notes": "Единственный пункт чанка извлечен как требование к папке контрагента."
  },
  "skipped_source_items": [],
  "statements": [
    {
      "statement_id": "doc_007_chunk_0004_stmt_001",
      "statement": "В папке контрагента должно находиться фото открытого щита или щитов, где будут проводиться работы.",
      "statement_type": "checklist_item",
      "roles": [
        "manager"
      ],
      "topic": "installation_request_check",
      "source_document_id": "doc_007",
      "source_file": "Проверка_соответвие_описания_менеджера_правилам_заявки_на_монтаж.docx",
      "source_chunk_id": "doc_007_chunk_0004",
      "section_path": [
        "Контроль исполнения технических функций менеджера по продажам",
        "Требования к действиям менеджера по продажам при оформлении заявки на монтаж",
        "- Фото открытого щита или щитов, в котором будут проводиться работы."
      ],
      "source_quote": "Фото открытого щита или щитов, в котором будут проводиться работы.",
      "source_quote_is_exact": true,
      "related_image_ids": [],
      "visual_review_required": false,
      "risk_level": "important",
      "confidence": "high",
      "review_status": "extracted",
      "scope": "Контроль исполнения технических функций менеджера по продажам",
      "condition": "",
      "action": "",
      "object": "",
      "normalized_terms": [],
      "extraction_notes": "Generated in batch 002 v3 with heading/table quality controls."
    }
  ]
}
