{
  "source_chunk_id": "doc_006_chunk_0006",
  "coverage_summary": {
    "source_items_detected": 7,
    "source_items_extracted": 6,
    "source_items_skipped": 1,
    "coverage_notes": "Все извлеченные пункты имеют точные цитаты; заголовки и неразобранные табличные блоки вынесены в skipped_source_items."
  },
  "skipped_source_items": [
    {
      "source_item_quote": "Инвертор и солнечный контроллер (если присутствует):",
      "source_item_type": "heading",
      "reason": "heading",
      "notes": "Заголовок раздела фотофиксации, не самостоятельное утверждение."
    }
  ],
  "statements": [
    {
      "statement_id": "doc_006_chunk_0006_stmt_001",
      "statement": "Фотоотчет должен содержать видео всех настроек инвертора.",
      "statement_type": "reporting_requirement",
      "roles": [
        "hq_engineer",
        "installer"
      ],
      "topic": "photo_report",
      "source_document_id": "doc_006",
      "source_file": "Правила_фотосъемки_монтажа_Чек_лист_ред1.docx",
      "source_chunk_id": "doc_006_chunk_0006",
      "section_path": [
        "Контрольный лист",
        "Фото монтажа",
        "Инвертор и солнечный контроллер (если присутствует):"
      ],
      "source_quote": "> \\[ \\] Записать на видео <span class=\"mark\">все</span> настройки инвертора. Если не удаётся записать видео, то сфотографировать все пункты меню настройки.",
      "source_quote_is_exact": true,
      "related_image_ids": [],
      "visual_review_required": false,
      "risk_level": "safety_critical",
      "confidence": "high",
      "review_status": "review_required",
      "scope": "Контрольный лист",
      "condition": "",
      "action": "",
      "object": "",
      "normalized_terms": [],
      "extraction_notes": "Generated in batch 002 v3 with heading/table quality controls."
    },
    {
      "statement_id": "doc_006_chunk_0006_stmt_002",
      "statement": "Если видео настроек инвертора записать не удается, фотоотчет должен содержать фотографии всех пунктов меню настройки.",
      "statement_type": "reporting_requirement",
      "roles": [
        "hq_engineer",
        "installer"
      ],
      "topic": "photo_report",
      "source_document_id": "doc_006",
      "source_file": "Правила_фотосъемки_монтажа_Чек_лист_ред1.docx",
      "source_chunk_id": "doc_006_chunk_0006",
      "section_path": [
        "Контрольный лист",
        "Фото монтажа",
        "Инвертор и солнечный контроллер (если присутствует):"
      ],
      "source_quote": "> \\[ \\] Записать на видео <span class=\"mark\">все</span> настройки инвертора. Если не удаётся записать видео, то сфотографировать все пункты меню настройки.",
      "source_quote_is_exact": true,
      "related_image_ids": [],
      "visual_review_required": false,
      "risk_level": "safety_critical",
      "confidence": "high",
      "review_status": "review_required",
      "scope": "Контрольный лист",
      "condition": "",
      "action": "",
      "object": "",
      "normalized_terms": [],
      "extraction_notes": "Generated in batch 002 v3 with heading/table quality controls."
    },
    {
      "statement_id": "doc_006_chunk_0006_stmt_003",
      "statement": "Фотоотчет должен содержать фото показаний на дисплее инвертора при работе с сетью.",
      "statement_type": "reporting_requirement",
      "roles": [
        "hq_engineer",
        "installer"
      ],
      "topic": "photo_report",
      "source_document_id": "doc_006",
      "source_file": "Правила_фотосъемки_монтажа_Чек_лист_ред1.docx",
      "source_chunk_id": "doc_006_chunk_0006",
      "section_path": [
        "Контрольный лист",
        "Фото монтажа",
        "Инвертор и солнечный контроллер (если присутствует):"
      ],
      "source_quote": "\\[ \\] Показания на дисплее при работе с сетью.",
      "source_quote_is_exact": true,
      "related_image_ids": [],
      "visual_review_required": false,
      "risk_level": "important",
      "confidence": "high",
      "review_status": "extracted",
      "scope": "Контрольный лист",
      "condition": "",
      "action": "",
      "object": "",
      "normalized_terms": [],
      "extraction_notes": "Generated in batch 002 v3 with heading/table quality controls."
    },
    {
      "statement_id": "doc_006_chunk_0006_stmt_004",
      "statement": "Фотоотчет должен содержать фото показаний на дисплее инвертора без сети.",
      "statement_type": "reporting_requirement",
      "roles": [
        "hq_engineer",
        "installer"
      ],
      "topic": "photo_report",
      "source_document_id": "doc_006",
      "source_file": "Правила_фотосъемки_монтажа_Чек_лист_ред1.docx",
      "source_chunk_id": "doc_006_chunk_0006",
      "section_path": [
        "Контрольный лист",
        "Фото монтажа",
        "Инвертор и солнечный контроллер (если присутствует):"
      ],
      "source_quote": "\\[ \\] Показания на дисплее без сети.",
      "source_quote_is_exact": true,
      "related_image_ids": [],
      "visual_review_required": false,
      "risk_level": "important",
      "confidence": "high",
      "review_status": "extracted",
      "scope": "Контрольный лист",
      "condition": "",
      "action": "",
      "object": "",
      "normalized_terms": [],
      "extraction_notes": "Generated in batch 002 v3 with heading/table quality controls."
    },
    {
      "statement_id": "doc_006_chunk_0006_stmt_005",
      "statement": "Фотоотчет должен содержать фото показаний на дисплее инвертора по максимальной нагрузке.",
      "statement_type": "reporting_requirement",
      "roles": [
        "hq_engineer",
        "installer"
      ],
      "topic": "photo_report",
      "source_document_id": "doc_006",
      "source_file": "Правила_фотосъемки_монтажа_Чек_лист_ред1.docx",
      "source_chunk_id": "doc_006_chunk_0006",
      "section_path": [
        "Контрольный лист",
        "Фото монтажа",
        "Инвертор и солнечный контроллер (если присутствует):"
      ],
      "source_quote": "\\[ \\] Показания на дисплее, максимальная нагрузка.",
      "source_quote_is_exact": true,
      "related_image_ids": [],
      "visual_review_required": false,
      "risk_level": "important",
      "confidence": "high",
      "review_status": "extracted",
      "scope": "Контрольный лист",
      "condition": "",
      "action": "",
      "object": "",
      "normalized_terms": [],
      "extraction_notes": "Generated in batch 002 v3 with heading/table quality controls."
    },
    {
      "statement_id": "doc_006_chunk_0006_stmt_006",
      "statement": "Фотоотчет должен содержать фото подключенного инвертора без нижней планки.",
      "statement_type": "reporting_requirement",
      "roles": [
        "hq_engineer",
        "installer"
      ],
      "topic": "photo_report",
      "source_document_id": "doc_006",
      "source_file": "Правила_фотосъемки_монтажа_Чек_лист_ред1.docx",
      "source_chunk_id": "doc_006_chunk_0006",
      "section_path": [
        "Контрольный лист",
        "Фото монтажа",
        "Инвертор и солнечный контроллер (если присутствует):"
      ],
      "source_quote": "\\[ \\] Подключенный инвертор без нижней планки.",
      "source_quote_is_exact": true,
      "related_image_ids": [],
      "visual_review_required": false,
      "risk_level": "safety_critical",
      "confidence": "high",
      "review_status": "review_required",
      "scope": "Контрольный лист",
      "condition": "",
      "action": "",
      "object": "",
      "normalized_terms": [],
      "extraction_notes": "Generated in batch 002 v3 with heading/table quality controls."
    }
  ]
}
