{
  "source_chunk_id": "doc_015_chunk_0017",
  "coverage_summary": {
    "source_items_detected": 1,
    "source_items_extracted": 1,
    "source_items_skipped": 0,
    "coverage_notes": "Извлечено единственное самостоятельное требование чанка."
  },
  "skipped_source_items": [],
  "statements": [
    {
      "statement_id": "doc_015_chunk_0017_stmt_001",
      "statement": "Для понимания схемы нужно внимательно изучить ее по принципу протекания токов, мысленно следуя от источника к нагрузке.",
      "statement_type": "recommendation",
      "roles": ["electrician", "installer"],
      "topic": "installation_process",
      "source_document_id": "doc_015",
      "source_file": "ЭЛК_3_Базовые_знания_Описание_этапов_монтажа_ред1_9.docx",
      "source_chunk_id": "doc_015_chunk_0017",
      "section_path": ["ЭЛК-Базовые знания", "Этапы монтажа", "Но для этого нужно внимательно изучить схему по принципу протекания токов мысленно следуя по схеме от источника к нагрузке."],
      "source_quote": "**Но для этого нужно внимательно изучить схему по принципу протекания токов мысленно следуя по схеме от источника к нагрузке.**",
      "source_quote_is_exact": true,
      "related_image_ids": [],
      "visual_review_required": false,
      "risk_level": "safety_critical",
      "confidence": "high",
      "review_status": "review_required",
      "scope": "Изучение схемы",
      "condition": "",
      "action": "Изучить схему по принципу протекания токов",
      "object": "Схема от источника к нагрузке",
      "normalized_terms": ["схема", "протекание токов", "источник", "нагрузка"],
      "extraction_notes": "Пункт связан с анализом электрической схемы, поэтому требует технического review."
    }
  ]
}
