{
  "source_chunk_id": "doc_006_chunk_0003",
  "coverage_summary": {
    "source_items_detected": 2,
    "source_items_extracted": 1,
    "source_items_skipped": 1,
    "coverage_notes": "Все извлеченные пункты имеют точные цитаты; заголовки и неразобранные табличные блоки вынесены в skipped_source_items."
  },
  "skipped_source_items": [
    {
      "source_item_quote": "После монтажа:",
      "source_item_type": "heading",
      "reason": "heading",
      "notes": "Заголовок раздела фотофиксации, не самостоятельное утверждение."
    }
  ],
  "statements": [
    {
      "statement_id": "doc_006_chunk_0003_stmt_001",
      "statement": "Фотоотчет после монтажа должен содержать 4-6 качественных фото системы с разных ракурсов, четкие и с запасом по бокам, снизу и сверху.",
      "statement_type": "reporting_requirement",
      "roles": [
        "hq_engineer",
        "installer"
      ],
      "topic": "photo_report",
      "source_document_id": "doc_006",
      "source_file": "Правила_фотосъемки_монтажа_Чек_лист_ред1.docx",
      "source_chunk_id": "doc_006_chunk_0003",
      "section_path": [
        "Контрольный лист",
        "Фото монтажа",
        "После монтажа:"
      ],
      "source_quote": "\\[ \\] 4-6 качественных фото системы с разных ракурсов. Убедиться, что фотографии чёткие и на них есть запас по бокам, снизу и сверху.",
      "source_quote_is_exact": true,
      "related_image_ids": [],
      "visual_review_required": false,
      "risk_level": "important",
      "confidence": "high",
      "review_status": "extracted",
      "scope": "Контрольный лист",
      "condition": "",
      "action": "",
      "object": "",
      "normalized_terms": [],
      "extraction_notes": "Generated in batch 002 v3 with heading/table quality controls."
    }
  ]
}
