{
  "source_chunk_id": "doc_006_chunk_0005",
  "coverage_summary": {
    "source_items_detected": 7,
    "source_items_extracted": 7,
    "source_items_skipped": 0,
    "coverage_notes": "Все выделенные source items извлечены или объясненно пропущены; рекрутинговый файл не включался."
  },
  "skipped_source_items": [],
  "statements": [
    {
      "statement_id": "doc_006_chunk_0005_stmt_001",
      "statement": "Для фотофиксации монтажа нужно выполнить требование: Фото элементов системы:.",
      "statement_type": "reporting_requirement",
      "roles": [
        "installer",
        "hq_engineer"
      ],
      "topic": "photo_report",
      "source_document_id": "doc_006",
      "source_file": "Правила_фотосъемки_монтажа_Чек_лист_ред1.docx",
      "source_chunk_id": "doc_006_chunk_0005",
      "section_path": [
        "Контрольный лист",
        "Фото монтажа",
        "Фото элементов системы:"
      ],
      "source_quote": "*Фото элементов системы:*",
      "source_quote_is_exact": true,
      "related_image_ids": [],
      "visual_review_required": false,
      "risk_level": "important",
      "confidence": "high",
      "review_status": "extracted",
      "scope": "Фотофиксация монтажа",
      "condition": "",
      "action": "",
      "object": "Фото элементов системы:",
      "normalized_terms": [],
      "extraction_notes": "Generated in batch 002 with coverage control."
    },
    {
      "statement_id": "doc_006_chunk_0005_stmt_002",
      "statement": "Для фотофиксации монтажа нужно выполнить требование: Щит автоматики после расключения без крышки.",
      "statement_type": "reporting_requirement",
      "roles": [
        "installer",
        "hq_engineer"
      ],
      "topic": "photo_report",
      "source_document_id": "doc_006",
      "source_file": "Правила_фотосъемки_монтажа_Чек_лист_ред1.docx",
      "source_chunk_id": "doc_006_chunk_0005",
      "section_path": [
        "Контрольный лист",
        "Фото монтажа",
        "Фото элементов системы:"
      ],
      "source_quote": "> \\[ \\] Щит автоматики после расключения без крышки.",
      "source_quote_is_exact": true,
      "related_image_ids": [],
      "visual_review_required": false,
      "risk_level": "important",
      "confidence": "high",
      "review_status": "extracted",
      "scope": "Фотофиксация монтажа",
      "condition": "",
      "action": "",
      "object": "Щит автоматики после расключения без крышки.",
      "normalized_terms": [],
      "extraction_notes": "Generated in batch 002 with coverage control."
    },
    {
      "statement_id": "doc_006_chunk_0005_stmt_003",
      "statement": "Для фотофиксации монтажа нужно выполнить требование: Щит автоматики с установленной крышкой и открытой дверцей (на фото должны быть видны все наклейки на дверце щита).",
      "statement_type": "reporting_requirement",
      "roles": [
        "installer",
        "hq_engineer"
      ],
      "topic": "photo_report",
      "source_document_id": "doc_006",
      "source_file": "Правила_фотосъемки_монтажа_Чек_лист_ред1.docx",
      "source_chunk_id": "doc_006_chunk_0005",
      "section_path": [
        "Контрольный лист",
        "Фото монтажа",
        "Фото элементов системы:"
      ],
      "source_quote": "> \\[ \\] Щит автоматики с установленной крышкой и открытой дверцей (на фото должны быть видны все наклейки на дверце щита).",
      "source_quote_is_exact": true,
      "related_image_ids": [],
      "visual_review_required": false,
      "risk_level": "important",
      "confidence": "high",
      "review_status": "extracted",
      "scope": "Фотофиксация монтажа",
      "condition": "",
      "action": "",
      "object": "Щит автоматики с установленной крышкой и открытой дверцей (на фото должны быть видны все наклейки на дверце щита).",
      "normalized_terms": [],
      "extraction_notes": "Generated in batch 002 with coverage control."
    },
    {
      "statement_id": "doc_006_chunk_0005_stmt_004",
      "statement": "Для фотофиксации монтажа нужно выполнить требование: Распаячные коробки, переходные щиты и т.д.",
      "statement_type": "reporting_requirement",
      "roles": [
        "installer",
        "hq_engineer"
      ],
      "topic": "photo_report",
      "source_document_id": "doc_006",
      "source_file": "Правила_фотосъемки_монтажа_Чек_лист_ред1.docx",
      "source_chunk_id": "doc_006_chunk_0005",
      "section_path": [
        "Контрольный лист",
        "Фото монтажа",
        "Фото элементов системы:"
      ],
      "source_quote": "> \\[ \\] Распаячные коробки, переходные щиты и т.д.",
      "source_quote_is_exact": true,
      "related_image_ids": [],
      "visual_review_required": false,
      "risk_level": "important",
      "confidence": "high",
      "review_status": "extracted",
      "scope": "Фотофиксация монтажа",
      "condition": "",
      "action": "",
      "object": "Распаячные коробки, переходные щиты и т.д.",
      "normalized_terms": [],
      "extraction_notes": "Generated in batch 002 with coverage control."
    },
    {
      "statement_id": "doc_006_chunk_0005_stmt_005",
      "statement": "Для фотофиксации монтажа нужно выполнить требование: Балансир или балансиры (они должны быть включены, а на фото должна быть видна их индикация).",
      "statement_type": "reporting_requirement",
      "roles": [
        "installer",
        "hq_engineer"
      ],
      "topic": "photo_report",
      "source_document_id": "doc_006",
      "source_file": "Правила_фотосъемки_монтажа_Чек_лист_ред1.docx",
      "source_chunk_id": "doc_006_chunk_0005",
      "section_path": [
        "Контрольный лист",
        "Фото монтажа",
        "Фото элементов системы:"
      ],
      "source_quote": "> \\[ \\] Балансир или балансиры (они должны быть включены, а на фото должна быть видна их индикация).",
      "source_quote_is_exact": true,
      "related_image_ids": [],
      "visual_review_required": false,
      "risk_level": "important",
      "confidence": "high",
      "review_status": "extracted",
      "scope": "Фотофиксация монтажа",
      "condition": "",
      "action": "",
      "object": "Балансир или балансиры (они должны быть включены, а на фото должна быть видна их индикация).",
      "normalized_terms": [],
      "extraction_notes": "Generated in batch 002 with coverage control."
    },
    {
      "statement_id": "doc_006_chunk_0005_stmt_006",
      "statement": "Для фотофиксации монтажа нужно выполнить требование: Установленная GSM розетка или несколько розеток.",
      "statement_type": "reporting_requirement",
      "roles": [
        "installer",
        "hq_engineer"
      ],
      "topic": "photo_report",
      "source_document_id": "doc_006",
      "source_file": "Правила_фотосъемки_монтажа_Чек_лист_ред1.docx",
      "source_chunk_id": "doc_006_chunk_0005",
      "section_path": [
        "Контрольный лист",
        "Фото монтажа",
        "Фото элементов системы:"
      ],
      "source_quote": "> \\[ \\] Установленная GSM розетка или несколько розеток.",
      "source_quote_is_exact": true,
      "related_image_ids": [],
      "visual_review_required": false,
      "risk_level": "important",
      "confidence": "high",
      "review_status": "extracted",
      "scope": "Фотофиксация монтажа",
      "condition": "",
      "action": "",
      "object": "Установленная GSM розетка или несколько розеток.",
      "normalized_terms": [],
      "extraction_notes": "Generated in batch 002 with coverage control."
    },
    {
      "statement_id": "doc_006_chunk_0005_stmt_007",
      "statement": "Для фотофиксации монтажа нужно выполнить требование: АТОМ (скриншот с данными при регистрации нового пользователя, скриншоты с показаниями из личного кабинета, фото размещения АТОМ).",
      "statement_type": "reporting_requirement",
      "roles": [
        "installer",
        "hq_engineer"
      ],
      "topic": "photo_report",
      "source_document_id": "doc_006",
      "source_file": "Правила_фотосъемки_монтажа_Чек_лист_ред1.docx",
      "source_chunk_id": "doc_006_chunk_0005",
      "section_path": [
        "Контрольный лист",
        "Фото монтажа",
        "Фото элементов системы:"
      ],
      "source_quote": "> \\[ \\] АТОМ (скриншот с данными при регистрации нового пользователя, скриншоты с показаниями из личного кабинета, фото размещения АТОМ).",
      "source_quote_is_exact": true,
      "related_image_ids": [],
      "visual_review_required": false,
      "risk_level": "important",
      "confidence": "high",
      "review_status": "extracted",
      "scope": "Фотофиксация монтажа",
      "condition": "",
      "action": "",
      "object": "АТОМ (скриншот с данными при регистрации нового пользователя, скриншоты с показаниями из личного кабинета, фото размещен",
      "normalized_terms": [],
      "extraction_notes": "Generated in batch 002 with coverage control."
    }
  ]
}
