{
  "source_chunk_id": "doc_006_chunk_0008",
  "coverage_summary": {
    "source_items_detected": 3,
    "source_items_extracted": 2,
    "source_items_skipped": 1,
    "coverage_notes": "Все извлеченные пункты имеют точные цитаты; заголовки и неразобранные табличные блоки вынесены в skipped_source_items."
  },
  "skipped_source_items": [
    {
      "source_item_quote": "Фото документов, актов, чеков:",
      "source_item_type": "heading",
      "reason": "heading",
      "notes": "Заголовок раздела фотофиксации, не самостоятельное утверждение."
    }
  ],
  "statements": [
    {
      "statement_id": "doc_006_chunk_0008_stmt_001",
      "statement": "При внесении записей в акты и иные документы фотоотчет должен содержать фото этого документа.",
      "statement_type": "reporting_requirement",
      "roles": [
        "hq_engineer",
        "installer"
      ],
      "topic": "photo_report",
      "source_document_id": "doc_006",
      "source_file": "Правила_фотосъемки_монтажа_Чек_лист_ред1.docx",
      "source_chunk_id": "doc_006_chunk_0008",
      "section_path": [
        "Контрольный лист",
        "Фото монтажа",
        "Фото документов, актов, чеков:"
      ],
      "source_quote": "\\[ \\] При внесении записей в акты и иные документы, данный документ необходимо сфотографировать.",
      "source_quote_is_exact": true,
      "related_image_ids": [],
      "visual_review_required": false,
      "risk_level": "important",
      "confidence": "high",
      "review_status": "extracted",
      "scope": "Контрольный лист",
      "condition": "",
      "action": "",
      "object": "",
      "normalized_terms": [],
      "extraction_notes": "Generated in batch 002 v3 with heading/table quality controls."
    },
    {
      "statement_id": "doc_006_chunk_0008_stmt_002",
      "statement": "После получения чеков через терминал их нужно сфотографировать и отправить в чат \"Оплаты на выезде\".",
      "statement_type": "reporting_requirement",
      "roles": [
        "hq_engineer",
        "installer"
      ],
      "topic": "photo_report",
      "source_document_id": "doc_006",
      "source_file": "Правила_фотосъемки_монтажа_Чек_лист_ред1.docx",
      "source_chunk_id": "doc_006_chunk_0008",
      "section_path": [
        "Контрольный лист",
        "Фото монтажа",
        "Фото документов, актов, чеков:"
      ],
      "source_quote": "\\[ \\] После получения чеков через терминал их необходимо сфотографировать и отправить в чат \"Оплаты на выезде\".",
      "source_quote_is_exact": true,
      "related_image_ids": [],
      "visual_review_required": false,
      "risk_level": "important",
      "confidence": "high",
      "review_status": "extracted",
      "scope": "Контрольный лист",
      "condition": "",
      "action": "",
      "object": "",
      "normalized_terms": [],
      "extraction_notes": "Generated in batch 002 v3 with heading/table quality controls."
    }
  ]
}
