{
  "source_chunk_id": "doc_006_chunk_0008",
  "coverage_summary": {
    "source_items_detected": 3,
    "source_items_extracted": 3,
    "source_items_skipped": 0,
    "coverage_notes": "Все выделенные source items извлечены или объясненно пропущены; рекрутинговый файл не включался."
  },
  "skipped_source_items": [],
  "statements": [
    {
      "statement_id": "doc_006_chunk_0008_stmt_001",
      "statement": "Для фотофиксации монтажа нужно выполнить требование: Фото документов, актов, чеков:.",
      "statement_type": "reporting_requirement",
      "roles": [
        "installer",
        "hq_engineer"
      ],
      "topic": "photo_report",
      "source_document_id": "doc_006",
      "source_file": "Правила_фотосъемки_монтажа_Чек_лист_ред1.docx",
      "source_chunk_id": "doc_006_chunk_0008",
      "section_path": [
        "Контрольный лист",
        "Фото монтажа",
        "Фото документов, актов, чеков:"
      ],
      "source_quote": "*Фото документов, актов, чеков:*",
      "source_quote_is_exact": true,
      "related_image_ids": [],
      "visual_review_required": false,
      "risk_level": "important",
      "confidence": "high",
      "review_status": "extracted",
      "scope": "Фотофиксация монтажа",
      "condition": "",
      "action": "",
      "object": "Фото документов, актов, чеков:",
      "normalized_terms": [],
      "extraction_notes": "Generated in batch 002 with coverage control."
    },
    {
      "statement_id": "doc_006_chunk_0008_stmt_002",
      "statement": "Для фотофиксации монтажа нужно выполнить требование: При внесении записей в акты и иные документы, данный документ необходимо сфотографировать.",
      "statement_type": "reporting_requirement",
      "roles": [
        "installer",
        "hq_engineer"
      ],
      "topic": "photo_report",
      "source_document_id": "doc_006",
      "source_file": "Правила_фотосъемки_монтажа_Чек_лист_ред1.docx",
      "source_chunk_id": "doc_006_chunk_0008",
      "section_path": [
        "Контрольный лист",
        "Фото монтажа",
        "Фото документов, актов, чеков:"
      ],
      "source_quote": "> \\[ \\] При внесении записей в акты и иные документы, данный документ необходимо сфотографировать.",
      "source_quote_is_exact": true,
      "related_image_ids": [],
      "visual_review_required": false,
      "risk_level": "important",
      "confidence": "high",
      "review_status": "extracted",
      "scope": "Фотофиксация монтажа",
      "condition": "",
      "action": "",
      "object": "При внесении записей в акты и иные документы, данный документ необходимо сфотографировать.",
      "normalized_terms": [],
      "extraction_notes": "Generated in batch 002 with coverage control."
    },
    {
      "statement_id": "doc_006_chunk_0008_stmt_003",
      "statement": "Для фотофиксации монтажа нужно выполнить требование: После получения чеков через терминал их необходимо сфотографировать и отправить в чат \"Оплаты на выезде\".",
      "statement_type": "reporting_requirement",
      "roles": [
        "installer",
        "hq_engineer"
      ],
      "topic": "photo_report",
      "source_document_id": "doc_006",
      "source_file": "Правила_фотосъемки_монтажа_Чек_лист_ред1.docx",
      "source_chunk_id": "doc_006_chunk_0008",
      "section_path": [
        "Контрольный лист",
        "Фото монтажа",
        "Фото документов, актов, чеков:"
      ],
      "source_quote": "> \\[ \\] После получения чеков через терминал их необходимо сфотографировать и отправить в чат \"Оплаты на выезде\".",
      "source_quote_is_exact": true,
      "related_image_ids": [],
      "visual_review_required": false,
      "risk_level": "important",
      "confidence": "high",
      "review_status": "extracted",
      "scope": "Фотофиксация монтажа",
      "condition": "",
      "action": "",
      "object": "После получения чеков через терминал их необходимо сфотографировать и отправить в чат \"Оплаты на выезде\".",
      "normalized_terms": [],
      "extraction_notes": "Generated in batch 002 with coverage control."
    }
  ]
}
