{
  "source_chunk_id": "doc_015_chunk_0006",
  "coverage_summary": {
    "source_items_detected": 2,
    "source_items_extracted": 1,
    "source_items_skipped": 1,
    "coverage_notes": "Извлечен единственный содержательный пункт; заголовок пропущен."
  },
  "skipped_source_items": [
    {
      "source_item_quote": "**3) Подключение ИБП к щиту клиента:**",
      "source_item_type": "heading",
      "reason": "heading",
      "notes": "Заголовок раздела не является самостоятельным знанием."
    }
  ],
  "statements": [
    {
      "statement_id": "doc_015_chunk_0006_stmt_001",
      "statement": "При подключении ИБП к щиту клиента монтажник должен выделить группу потребителей, устанавливаемых в резерв, в щите заказчика.",
      "statement_type": "process_step",
      "roles": ["electrician", "installer"],
      "topic": "installation_process",
      "source_document_id": "doc_015",
      "source_file": "ЭЛК_3_Базовые_знания_Описание_этапов_монтажа_ред1_9.docx",
      "source_chunk_id": "doc_015_chunk_0006",
      "section_path": ["ЭЛК-Базовые знания", "Этапы монтажа", "3) Подключение ИБП к щиту клиента:"],
      "source_quote": "\\- Выделение группы потребителей, устанавливаемых в резерв (в щите заказчика).",
      "source_quote_is_exact": true,
      "related_image_ids": [],
      "visual_review_required": false,
      "risk_level": "safety_critical",
      "confidence": "high",
      "review_status": "review_required",
      "scope": "Подключение ИБП к щиту клиента",
      "condition": "",
      "action": "Выделить группу потребителей, устанавливаемых в резерв",
      "object": "Группа потребителей в щите заказчика",
      "normalized_terms": ["ИБП", "щит заказчика", "группа резерва"],
      "extraction_notes": "Пункт относится к работе в щите клиента и схеме резервной группы, поэтому требует технического review."
    }
  ]
}
