{
  "source_chunk_id": "doc_005_chunk_0006",
  "coverage_summary": {
    "source_items_detected": 5,
    "source_items_extracted": 5,
    "source_items_skipped": 0,
    "coverage_notes": "Все извлеченные пункты имеют точные цитаты; заголовки и неразобранные табличные блоки вынесены в skipped_source_items."
  },
  "skipped_source_items": [],
  "statements": [
    {
      "statement_id": "doc_005_chunk_0006_stmt_001",
      "statement": "Отчет по монтажу должен фиксировать температуру в месте установки системы.",
      "statement_type": "reporting_requirement",
      "roles": [
        "hq_engineer",
        "installer",
        "manager"
      ],
      "topic": "reporting",
      "source_document_id": "doc_005",
      "source_file": "Отчет по монтажу р1.docx",
      "source_chunk_id": "doc_005_chunk_0006",
      "section_path": [
        "Шаблон отчета по монтажу:",
        "Пример: Установлена Бесперебойная система контроль 5/400",
        "Температура в месте установки 24С."
      ],
      "source_quote": "Температура в месте установки 24С.",
      "source_quote_is_exact": true,
      "related_image_ids": [],
      "visual_review_required": false,
      "risk_level": "important",
      "confidence": "high",
      "review_status": "extracted",
      "scope": "Шаблон отчета по монтажу:",
      "condition": "",
      "action": "",
      "object": "",
      "normalized_terms": [],
      "extraction_notes": "Generated in batch 002 v3 with heading/table quality controls."
    },
    {
      "statement_id": "doc_005_chunk_0006_stmt_002",
      "statement": "Отчет по монтажу должен фиксировать автоматы, установленные в группе резерва.",
      "statement_type": "reporting_requirement",
      "roles": [
        "hq_engineer",
        "installer",
        "manager"
      ],
      "topic": "reporting",
      "source_document_id": "doc_005",
      "source_file": "Отчет по монтажу р1.docx",
      "source_chunk_id": "doc_005_chunk_0006",
      "section_path": [
        "Шаблон отчета по монтажу:",
        "Пример: Установлена Бесперебойная система контроль 5/400",
        "Температура в месте установки 24С."
      ],
      "source_quote": "В группе резерва установлены автоматы N.....",
      "source_quote_is_exact": true,
      "related_image_ids": [],
      "visual_review_required": false,
      "risk_level": "safety_critical",
      "confidence": "high",
      "review_status": "review_required",
      "scope": "Шаблон отчета по монтажу:",
      "condition": "",
      "action": "",
      "object": "",
      "normalized_terms": [],
      "extraction_notes": "Generated in batch 002 v3 with heading/table quality controls."
    },
    {
      "statement_id": "doc_005_chunk_0006_stmt_003",
      "statement": "Отчет по монтажу фиксирует: Также подключена 1 фаза трехполюсного автомата, отвечающего за дом, 1/2 этаж, гараж, котельную, баню и т.д.",
      "statement_type": "reporting_requirement",
      "roles": [
        "hq_engineer",
        "installer",
        "manager"
      ],
      "topic": "reporting",
      "source_document_id": "doc_005",
      "source_file": "Отчет по монтажу р1.docx",
      "source_chunk_id": "doc_005_chunk_0006",
      "section_path": [
        "Шаблон отчета по монтажу:",
        "Пример: Установлена Бесперебойная система контроль 5/400",
        "Температура в месте установки 24С."
      ],
      "source_quote": "Также подключена 1 фаза трехполюсного автомата, отвечающего за дом, 1/2 этаж, гараж, котельную, баню и т.д.",
      "source_quote_is_exact": true,
      "related_image_ids": [],
      "visual_review_required": false,
      "risk_level": "safety_critical",
      "confidence": "high",
      "review_status": "review_required",
      "scope": "Шаблон отчета по монтажу:",
      "condition": "",
      "action": "",
      "object": "",
      "normalized_terms": [],
      "extraction_notes": "Generated in batch 002 v3 with heading/table quality controls."
    },
    {
      "statement_id": "doc_005_chunk_0006_stmt_004",
      "statement": "Отчет по монтажу фиксирует: Щит дома, гаража, 1/2 этажа, котельной, бани и т.д. подключены автоматы N.",
      "statement_type": "reporting_requirement",
      "roles": [
        "hq_engineer",
        "installer",
        "manager"
      ],
      "topic": "reporting",
      "source_document_id": "doc_005",
      "source_file": "Отчет по монтажу р1.docx",
      "source_chunk_id": "doc_005_chunk_0006",
      "section_path": [
        "Шаблон отчета по монтажу:",
        "Пример: Установлена Бесперебойная система контроль 5/400",
        "Температура в месте установки 24С."
      ],
      "source_quote": "Щит дома, гаража, 1/2 этажа, котельной, бани и т.д. подключены автоматы N....",
      "source_quote_is_exact": true,
      "related_image_ids": [],
      "visual_review_required": false,
      "risk_level": "safety_critical",
      "confidence": "high",
      "review_status": "review_required",
      "scope": "Шаблон отчета по монтажу:",
      "condition": "",
      "action": "",
      "object": "",
      "normalized_terms": [],
      "extraction_notes": "Generated in batch 002 v3 with heading/table quality controls."
    },
    {
      "statement_id": "doc_005_chunk_0006_stmt_005",
      "statement": "Отчет по монтажу фиксирует: По просьбе клиента добавлены автоматы в группу резерва и т.д.",
      "statement_type": "reporting_requirement",
      "roles": [
        "hq_engineer",
        "installer",
        "manager"
      ],
      "topic": "reporting",
      "source_document_id": "doc_005",
      "source_file": "Отчет по монтажу р1.docx",
      "source_chunk_id": "doc_005_chunk_0006",
      "section_path": [
        "Шаблон отчета по монтажу:",
        "Пример: Установлена Бесперебойная система контроль 5/400",
        "Температура в месте установки 24С."
      ],
      "source_quote": "По просьбе клиента добавлены автоматы в группу резерва и т.д.",
      "source_quote_is_exact": true,
      "related_image_ids": [],
      "visual_review_required": false,
      "risk_level": "safety_critical",
      "confidence": "high",
      "review_status": "review_required",
      "scope": "Шаблон отчета по монтажу:",
      "condition": "",
      "action": "",
      "object": "",
      "normalized_terms": [],
      "extraction_notes": "Generated in batch 002 v3 with heading/table quality controls."
    }
  ]
}
