{
  "source_chunk_id": "doc_005_chunk_0025",
  "coverage_summary": {
    "source_items_detected": 3,
    "source_items_extracted": 2,
    "source_items_skipped": 1,
    "coverage_notes": "Все извлеченные пункты имеют точные цитаты; заголовки и неразобранные табличные блоки вынесены в skipped_source_items."
  },
  "skipped_source_items": [
    {
      "source_item_quote": "ПРИМЕР 2:",
      "source_item_type": "heading",
      "reason": "heading",
      "notes": "Заголовок или служебная метка примера, не самостоятельное утверждение."
    }
  ],
  "statements": [
    {
      "statement_id": "doc_005_chunk_0025_stmt_001",
      "statement": "Пример отчета фиксирует, что в процессе монтажа балансир вышел из строя при включении.",
      "statement_type": "reporting_requirement",
      "roles": [
        "hq_engineer",
        "installer",
        "manager"
      ],
      "topic": "reporting",
      "source_document_id": "doc_005",
      "source_file": "Отчет по монтажу р1.docx",
      "source_chunk_id": "doc_005_chunk_0025",
      "section_path": [
        "Шаблон отчета по монтажу:",
        "Пример: Установлена Бесперебойная система контроль 5/400",
        "В процессе монтажа вышел из строя балансир(при включении), заменен на новый из набора ЗИП."
      ],
      "source_quote": "В процессе монтажа вышел из строя балансир(при включении), заменен на новый из набора ЗИП.",
      "source_quote_is_exact": true,
      "related_image_ids": [],
      "visual_review_required": false,
      "risk_level": "important",
      "confidence": "high",
      "review_status": "extracted",
      "scope": "Шаблон отчета по монтажу:",
      "condition": "",
      "action": "",
      "object": "",
      "normalized_terms": [],
      "extraction_notes": "Generated in batch 002 v3 with heading/table quality controls."
    },
    {
      "statement_id": "doc_005_chunk_0025_stmt_002",
      "statement": "Пример отчета фиксирует замену вышедшего из строя балансира на новый из набора ЗИП.",
      "statement_type": "reporting_requirement",
      "roles": [
        "hq_engineer",
        "installer",
        "manager"
      ],
      "topic": "reporting",
      "source_document_id": "doc_005",
      "source_file": "Отчет по монтажу р1.docx",
      "source_chunk_id": "doc_005_chunk_0025",
      "section_path": [
        "Шаблон отчета по монтажу:",
        "Пример: Установлена Бесперебойная система контроль 5/400",
        "В процессе монтажа вышел из строя балансир(при включении), заменен на новый из набора ЗИП."
      ],
      "source_quote": "В процессе монтажа вышел из строя балансир(при включении), заменен на новый из набора ЗИП.",
      "source_quote_is_exact": true,
      "related_image_ids": [],
      "visual_review_required": false,
      "risk_level": "important",
      "confidence": "high",
      "review_status": "extracted",
      "scope": "Шаблон отчета по монтажу:",
      "condition": "",
      "action": "",
      "object": "",
      "normalized_terms": [],
      "extraction_notes": "Generated in batch 002 v3 with heading/table quality controls."
    }
  ]
}
