{
  "source_chunk_id": "doc_005_chunk_0037",
  "coverage_summary": {
    "source_items_detected": 1,
    "source_items_extracted": 1,
    "source_items_skipped": 0,
    "coverage_notes": "Все извлеченные пункты имеют точные цитаты; заголовки и неразобранные табличные блоки вынесены в skipped_source_items."
  },
  "skipped_source_items": [],
  "statements": [
    {
      "statement_id": "doc_005_chunk_0037_stmt_001",
      "statement": "В особенностях отчета фиксируется использование системы в ручном режиме.",
      "statement_type": "reporting_requirement",
      "roles": [
        "hq_engineer",
        "installer",
        "manager"
      ],
      "topic": "reporting",
      "source_document_id": "doc_005",
      "source_file": "Отчет по монтажу р1.docx",
      "source_chunk_id": "doc_005_chunk_0037",
      "section_path": [
        "Шаблон отчета по монтажу:",
        "Пример: Установлена Бесперебойная система контроль 5/400",
        "6.Система будет использоваться в ручном режиме, клиент подписал соответствующую расписку."
      ],
      "source_quote": "Система будет использоваться в ручном режиме, клиент подписал соответствующую расписку.",
      "source_quote_is_exact": true,
      "related_image_ids": [],
      "visual_review_required": false,
      "risk_level": "important",
      "confidence": "high",
      "review_status": "extracted",
      "scope": "Шаблон отчета по монтажу:",
      "condition": "",
      "action": "",
      "object": "",
      "normalized_terms": [],
      "extraction_notes": "Generated in batch 002 v3 with heading/table quality controls."
    }
  ]
}
