{
  "source_chunk_id": "doc_015_chunk_0012",
  "coverage_summary": {
    "source_items_detected": 6,
    "source_items_extracted": 5,
    "source_items_skipped": 1,
    "coverage_notes": "Извлечены все 5 требований из списка; заголовок пропущен."
  },
  "skipped_source_items": [
    {
      "source_item_quote": "**Основная задача при монтаже ИБП — сделать без ошибок все подключения и следовать требованиям завода изготовителя:**",
      "source_item_type": "heading",
      "reason": "heading",
      "notes": "Заголовок раздела не является самостоятельным знанием."
    }
  ],
  "statements": [
    {
      "statement_id": "doc_015_chunk_0012_stmt_001",
      "statement": "При монтаже ИБП необходимо четко следить за полярностью по постоянному напряжению DC.",
      "statement_type": "requirement",
      "roles": ["electrician", "installer"],
      "topic": "installation_process",
      "source_document_id": "doc_015",
      "source_file": "ЭЛК_3_Базовые_знания_Описание_этапов_монтажа_ред1_9.docx",
      "source_chunk_id": "doc_015_chunk_0012",
      "section_path": ["ЭЛК-Базовые знания", "Этапы монтажа", "Основная задача при монтаже ИБП — сделать без ошибок все подключения и следовать требованиям завода изготовителя:"],
      "source_quote": "\\- Необходимо четко следить за полярностью (+/-) по постоянному напряжению (DC).",
      "source_quote_is_exact": true,
      "related_image_ids": [],
      "visual_review_required": false,
      "risk_level": "safety_critical",
      "confidence": "high",
      "review_status": "review_required",
      "scope": "Монтаж ИБП",
      "condition": "",
      "action": "Следить за полярностью",
      "object": "Полярность (+/-) по постоянному напряжению DC",
      "normalized_terms": ["ИБП", "полярность", "DC"],
      "extraction_notes": ""
    },
    {
      "statement_id": "doc_015_chunk_0012_stmt_002",
      "statement": "При монтаже ИБП нельзя допускать ошибок при фазировке, то есть при подключении фазного и нулевого проводов по высокому напряжению AC.",
      "statement_type": "prohibition",
      "roles": ["electrician", "installer"],
      "topic": "installation_process",
      "source_document_id": "doc_015",
      "source_file": "ЭЛК_3_Базовые_знания_Описание_этапов_монтажа_ред1_9.docx",
      "source_chunk_id": "doc_015_chunk_0012",
      "section_path": ["ЭЛК-Базовые знания", "Этапы монтажа", "Основная задача при монтаже ИБП — сделать без ошибок все подключения и следовать требованиям завода изготовителя:"],
      "source_quote": "\\- Не допускать ошибок при фазировке (подключении фазного провода и нулевого) по высокому напряжению (AC).",
      "source_quote_is_exact": true,
      "related_image_ids": [],
      "visual_review_required": false,
      "risk_level": "safety_critical",
      "confidence": "high",
      "review_status": "review_required",
      "scope": "Монтаж ИБП",
      "condition": "",
      "action": "Не допускать ошибок при фазировке",
      "object": "Подключение фазного и нулевого проводов по AC",
      "normalized_terms": ["ИБП", "фазировка", "фазный провод", "нулевой провод", "AC"],
      "extraction_notes": ""
    },
    {
      "statement_id": "doc_015_chunk_0012_stmt_003",
      "statement": "При монтаже ИБП необходимо контролировать подключение входа и выхода.",
      "statement_type": "requirement",
      "roles": ["electrician", "installer"],
      "topic": "installation_process",
      "source_document_id": "doc_015",
      "source_file": "ЭЛК_3_Базовые_знания_Описание_этапов_монтажа_ред1_9.docx",
      "source_chunk_id": "doc_015_chunk_0012",
      "section_path": ["ЭЛК-Базовые знания", "Этапы монтажа", "Основная задача при монтаже ИБП — сделать без ошибок все подключения и следовать требованиям завода изготовителя:"],
      "source_quote": "\\- А также контролировать подключение «входа» и «выхода».",
      "source_quote_is_exact": true,
      "related_image_ids": [],
      "visual_review_required": false,
      "risk_level": "safety_critical",
      "confidence": "high",
      "review_status": "review_required",
      "scope": "Монтаж ИБП",
      "condition": "",
      "action": "Контролировать подключение",
      "object": "Вход и выход",
      "normalized_terms": ["ИБП", "вход", "выход"],
      "extraction_notes": ""
    },
    {
      "statement_id": "doc_015_chunk_0012_stmt_004",
      "statement": "При монтаже ИБП необходимо четко контролировать момент затяжки болтовых и винтовых соединений и не допускать их повреждения.",
      "statement_type": "requirement",
      "roles": ["electrician", "installer"],
      "topic": "installation_process",
      "source_document_id": "doc_015",
      "source_file": "ЭЛК_3_Базовые_знания_Описание_этапов_монтажа_ред1_9.docx",
      "source_chunk_id": "doc_015_chunk_0012",
      "section_path": ["ЭЛК-Базовые знания", "Этапы монтажа", "Основная задача при монтаже ИБП — сделать без ошибок все подключения и следовать требованиям завода изготовителя:"],
      "source_quote": "\\- Четко контролировать момент затяжки болтовых и винтовых соединений, не допуская их повреждения.",
      "source_quote_is_exact": true,
      "related_image_ids": [],
      "visual_review_required": false,
      "risk_level": "safety_critical",
      "confidence": "high",
      "review_status": "review_required",
      "scope": "Монтаж ИБП",
      "condition": "",
      "action": "Контролировать момент затяжки и не допускать повреждения соединений",
      "object": "Болтовые и винтовые соединения",
      "normalized_terms": ["момент затяжки", "болтовые соединения", "винтовые соединения"],
      "extraction_notes": ""
    },
    {
      "statement_id": "doc_015_chunk_0012_stmt_005",
      "statement": "При монтаже ИБП желательно использовать динамометрическую отвертку.",
      "statement_type": "recommendation",
      "roles": ["electrician", "installer"],
      "topic": "installation_process",
      "source_document_id": "doc_015",
      "source_file": "ЭЛК_3_Базовые_знания_Описание_этапов_монтажа_ред1_9.docx",
      "source_chunk_id": "doc_015_chunk_0012",
      "section_path": ["ЭЛК-Базовые знания", "Этапы монтажа", "Основная задача при монтаже ИБП — сделать без ошибок все подключения и следовать требованиям завода изготовителя:"],
      "source_quote": "\\- Желательно использовать динамометрическую отвертку.",
      "source_quote_is_exact": true,
      "related_image_ids": [],
      "visual_review_required": false,
      "risk_level": "ordinary",
      "confidence": "high",
      "review_status": "extracted",
      "scope": "Монтаж ИБП",
      "condition": "",
      "action": "Использовать динамометрическую отвертку",
      "object": "Динамометрическая отвертка",
      "normalized_terms": ["динамометрическая отвертка"],
      "extraction_notes": ""
    }
  ]
}
