{
  "source_chunk_id": "doc_006_chunk_0002",
  "coverage_summary": {
    "source_items_detected": 4,
    "source_items_extracted": 4,
    "source_items_skipped": 0,
    "coverage_notes": "Все выделенные source items извлечены или объясненно пропущены; рекрутинговый файл не включался."
  },
  "skipped_source_items": [],
  "statements": [
    {
      "statement_id": "doc_006_chunk_0002_stmt_001",
      "statement": "Для фотофиксации монтажа нужно выполнить требование: Перед монтажом:** Обязательная подстраховка.",
      "statement_type": "reporting_requirement",
      "roles": [
        "installer",
        "hq_engineer"
      ],
      "topic": "photo_report",
      "source_document_id": "doc_006",
      "source_file": "Правила_фотосъемки_монтажа_Чек_лист_ред1.docx",
      "source_chunk_id": "doc_006_chunk_0002",
      "section_path": [
        "Контрольный лист",
        "Фото монтажа"
      ],
      "source_quote": "**Перед монтажом:** Обязательная подстраховка",
      "source_quote_is_exact": true,
      "related_image_ids": [],
      "visual_review_required": false,
      "risk_level": "important",
      "confidence": "high",
      "review_status": "extracted",
      "scope": "Фотофиксация монтажа",
      "condition": "",
      "action": "",
      "object": "Перед монтажом:** Обязательная подстраховка",
      "normalized_terms": [],
      "extraction_notes": "Generated in batch 002 with coverage control."
    },
    {
      "statement_id": "doc_006_chunk_0002_stmt_002",
      "statement": "Для фотофиксации монтажа нужно выполнить требование: Фото щита заказчика до первого действия с ним. Должно быть видно положение каждого автомата.",
      "statement_type": "reporting_requirement",
      "roles": [
        "installer",
        "hq_engineer"
      ],
      "topic": "photo_report",
      "source_document_id": "doc_006",
      "source_file": "Правила_фотосъемки_монтажа_Чек_лист_ред1.docx",
      "source_chunk_id": "doc_006_chunk_0002",
      "section_path": [
        "Контрольный лист",
        "Фото монтажа"
      ],
      "source_quote": "\\[ \\] Фото щита заказчика до первого действия с ним. Должно быть видно положение каждого автомата.",
      "source_quote_is_exact": true,
      "related_image_ids": [],
      "visual_review_required": false,
      "risk_level": "important",
      "confidence": "high",
      "review_status": "extracted",
      "scope": "Фотофиксация монтажа",
      "condition": "",
      "action": "",
      "object": "Фото щита заказчика до первого действия с ним. Должно быть видно положение каждого автомата.",
      "normalized_terms": [],
      "extraction_notes": "Generated in batch 002 with coverage control."
    },
    {
      "statement_id": "doc_006_chunk_0002_stmt_003",
      "statement": "Для фотофиксации монтажа нужно выполнить требование: Фото всех проводов в щите. Должны быть видны места креплений проводов.",
      "statement_type": "reporting_requirement",
      "roles": [
        "installer",
        "hq_engineer"
      ],
      "topic": "photo_report",
      "source_document_id": "doc_006",
      "source_file": "Правила_фотосъемки_монтажа_Чек_лист_ред1.docx",
      "source_chunk_id": "doc_006_chunk_0002",
      "section_path": [
        "Контрольный лист",
        "Фото монтажа"
      ],
      "source_quote": "\\[ \\] Фото всех проводов в щите. Должны быть видны места креплений проводов.",
      "source_quote_is_exact": true,
      "related_image_ids": [],
      "visual_review_required": false,
      "risk_level": "important",
      "confidence": "high",
      "review_status": "extracted",
      "scope": "Фотофиксация монтажа",
      "condition": "",
      "action": "",
      "object": "Фото всех проводов в щите. Должны быть видны места креплений проводов.",
      "normalized_terms": [],
      "extraction_notes": "Generated in batch 002 with coverage control."
    },
    {
      "statement_id": "doc_006_chunk_0002_stmt_004",
      "statement": "Для фотофиксации монтажа нужно выполнить требование: Сделать иные фотографии. Подгорелая проводка и т.п.",
      "statement_type": "reporting_requirement",
      "roles": [
        "installer",
        "hq_engineer"
      ],
      "topic": "photo_report",
      "source_document_id": "doc_006",
      "source_file": "Правила_фотосъемки_монтажа_Чек_лист_ред1.docx",
      "source_chunk_id": "doc_006_chunk_0002",
      "section_path": [
        "Контрольный лист",
        "Фото монтажа"
      ],
      "source_quote": "\\[ \\] Сделать иные фотографии. Подгорелая проводка и т.п.",
      "source_quote_is_exact": true,
      "related_image_ids": [],
      "visual_review_required": false,
      "risk_level": "important",
      "confidence": "high",
      "review_status": "extracted",
      "scope": "Фотофиксация монтажа",
      "condition": "",
      "action": "",
      "object": "Сделать иные фотографии. Подгорелая проводка и т.п.",
      "normalized_terms": [],
      "extraction_notes": "Generated in batch 002 with coverage control."
    }
  ]
}
