{
  "source_chunk_id": "doc_007_chunk_0001",
  "coverage_summary": {
    "source_items_detected": 1,
    "source_items_extracted": 0,
    "source_items_skipped": 1,
    "coverage_notes": "Все извлеченные пункты имеют точные цитаты; заголовки и неразобранные табличные блоки вынесены в skipped_source_items."
  },
  "skipped_source_items": [
    {
      "source_item_quote": "Контроль исполнения технических функций менеджера по продажам",
      "source_item_type": "heading",
      "reason": "heading",
      "notes": "Заголовок или вводная метка раздела, не самостоятельное утверждение."
    }
  ],
  "statements": []
}
